{
  "name": "Storm Brand of Indecision",
  "transfigured": true,
  "colour": "B",
  "required_level": 12,
  "tags": ["lightning", "spell", "aoe", "chaining", "duration", "brand"],
  "description": "Creates a magical brand which can attach to a nearby enemy. It periodically activates while attached, firing beams which deal damage to nearby enemies and those around them. The brand will detach if the enemy dies.",
  "cost": { "min": 8, "max": 21 },
  "cast_time": 0.35,
  "critical_chance": 0.06,
  "added_damage_effectiveness": 0.85,
  "effects": [
    "Deals (6-229) to (19-686) Lightning Damage",
    "Activates every 0.4 seconds while Attached",
    "Increases and Reductions to Cast Speed also apply to this Skill's Activation frequency",
    "Attaches to a new Enemy after Activating, no more than once every 0.3 seconds",
    "Can be Detached for a total Duration of 6.00 seconds",
    "Can be Attached for a total Duration of 5.00 seconds",
    "Sends a beam to the Branded Enemy"
  ],
  "quality_effects": [
    "Deals +1% more Damage with Hits against Branded Enemy"
  ]
}