{
  "name": "Storm Brand",
  "colour": "B",
  "required_level": 12,
  "tags": ["lightning", "spell", "aoe", "chaining", "duration", "brand"],
  "description": "Creates a magical brand which can attach to a nearby enemy. It periodically activates while attached, firing beams which deal damage to nearby enemies and those around them. The brand will detach if the enemy dies.",
  "cost": { "min": 8, "max": 21 },
  "cast_time": 0.75,
  "critical_chance": 0.06,
  "added_damage_effectiveness": 0.3,
  "effects": [
    "Deals (3-92) to (8-277) Lightning Damage",
    "Activates every 0.5 seconds while Attached",
    "Increases and Reductions to Cast Speed also apply to this Skill's Activation frequency",
    "Can be Detached for a total Duration of 6.00 seconds",
    "Can be Attached for a total Duration of 5.00 seconds",
    "Sends beams to 3 Enemies, including the Branded Enemy",
    "Deals (80-130)% more Damage with Hits against Branded Enemy"
  ],
  "quality_effects": [
    "Sends beams to +0.05 Enemies"
  ]
}